{
 "artifact": "pma_market_frame",
 "run_date": "2026-08-12",
 "generated_at": "2026-08-12T07:57:27+00:00",
 "staleness": {
  "export_date": "2026-07-28",
  "staleness_days": 15,
  "pm_ack": "DRY-RUN 2026-08-12 — export is 15 days stale (2026-07-28); today's 2.79MB export cannot transit the Drive connector without credentials (gap G4). Crown macro IS today's live file. Frame test only, NOT for trading."
 },
 "risk_tone": {
  "value": "YELLOW",
  "source": "regime.level"
 },
 "momentum_caveat": {
  "text": "Tape reads TRENDING (hurst 0.603, VIX 18.7, regime YELLOW): Momentum strategies favoured.",
  "hurst": 0.603,
  "trend": "TRENDING",
  "implication": "Momentum strategies favoured",
  "vix": 18.7,
  "sources": [
   "regime.hurst",
   "regime.trend",
   "regime.implication",
   "regime.vix"
  ]
 },
 "crown": {
  "present": true,
  "status": "DEGRADED",
  "headline": "A market with no clear breadth lead, calm on the surface but with single stocks moving very differently underneath.",
  "family": "BROADENING_CARRY",
  "match_quality": "partial",
  "size_multiplier": 1.0,
  "conditions_met": [
   "range_not_extreme",
   "cta_low_flip"
  ],
  "conditions_not_met": [
   "broadening",
   "gamma_positive",
   "dispersion_normal"
  ],
  "key_levels_near": [
   {
    "kind": "trend followers",
    "what": "Gold flip",
    "now": 4441.1,
    "level": 4449.6822,
    "unit": "price",
    "distance_pct": 0.19,
    "if_it_breaks": "Trend-following funds turn from seller to buyer here.",
    "source": "futures",
    "quotable_as_contract": true,
    "market": "GC",
    "sector": "metals",
    "trend_signal": -0.0075,
    "direction": "buy_above"
   },
   {
    "kind": "breadth",
    "what": "RSP/SPY 20-day average",
    "now": 0.286402,
    "level": 0.287185,
    "unit": "ratio",
    "distance_pct": 0.27,
    "if_it_breaks": "The average stock crossing below its own recent trend against the index. It turns before the regime label does.",
    "source": null,
    "quotable_as_contract": true
   },
   {
    "kind": "trend followers",
    "what": "UST 2Y note flip",
    "now": 102.957,
    "level": 103.7031,
    "unit": "price",
    "distance_pct": 0.72,
    "if_it_breaks": "Trend-following funds turn from seller to buyer here.",
    "source": "yahoo_futures",
    "quotable_as_contract": true,
    "market": "ZT",
    "sector": "rates",
    "trend_signal": -0.3764,
    "direction": "buy_above"
   },
   {
    "kind": "volatility",
    "what": "Single-stock vs index gap — elevated band",
    "now": 23.23,
    "level": 23.058,
    "unit": "vol points",
    "distance_pct": -0.74,
    "if_it_breaks": "Above here the index is hiding what individual names are doing. It only counts as a warning while the gap is still widening.",
    "source": null,
    "quotable_as_contract": true
   },
   {
    "kind": "trend followers",
    "what": "US dollar flip",
    "now": 99.868,
    "level": 98.9687,
    "unit": "price",
    "distance_pct": -0.9,
    "if_it_breaks": "Trend-following funds turn from buyer to seller here, and they all use much the same rule, so the selling arrives together.",
    "source": "yahoo_futures",
    "quotable_as_contract": true,
    "market": "DX",
    "sector": "fx",
    "trend_signal": 0.1373,
    "direction": "sell_below"
   },
   {
    "kind": "trend followers",
    "what": "UST 5Y note flip",
    "now": 106.3047,
    "level": 108.1304,
    "unit": "price",
    "distance_pct": 1.72,
    "if_it_breaks": "Trend-following funds turn from seller to buyer here.",
    "source": "yahoo_futures",
    "quotable_as_contract": true,
    "market": "ZF",
    "sector": "rates",
    "trend_signal": -0.3692,
    "direction": "buy_above"
   },
   {
    "kind": "volatility",
    "what": "VIX — premium-selling threshold",
    "now": 15.28,
    "level": 15.0,
    "unit": "vol points",
    "distance_pct": -1.83,
    "if_it_breaks": "Below this, with dealers damping moves, the tape favours selling premium over chasing breakouts.",
    "source": null,
    "quotable_as_contract": true
   },
   {
    "kind": "trend followers",
    "what": "UST 10Y note flip",
    "now": 108.4688,
    "level": 111.1038,
    "unit": "price",
    "distance_pct": 2.43,
    "if_it_breaks": "Trend-following funds turn from seller to buyer here.",
    "source": "yahoo_futures",
    "quotable_as_contract": true,
    "market": "ZN",
    "sector": "rates",
    "trend_signal": -0.3365,
    "direction": "buy_above"
   }
  ],
  "limits": [
   "These markets came from Yahoo rather than our data provider (CL, DX, HG, NG, NQ, RTY, YM, ZB, ZC, ZF, ZN, ZS, ZT, ZW). They are the real futures contracts, so the flip levels are quotable, but Yahoo is a free feed with no uptime guarantee.",
   "gamma unavailable — QQQ: alpaca: open-interest fetch failed (trading API): Alpaca keys missing: set ALPACA_API_KEY_ID + ALPACA_API_SECRET_KEY as deploy secrets (like FMP_API_KEY). | tiger: secret TIGER_ID not set; secret TIGER_ACCOUNT not set; secret TIGER_PRIVATE_KEY not set; SPY: alpaca: open-interest fetch failed (trading API): Alpaca keys missing: set ALPACA_API_KEY_ID + ALPACA_API_SECRET_KEY as deploy secrets (like FMP_API_KEY). | tiger: secret TIGER_ID not set; secret TIGER_ACCOUNT not set; secret TIGER_PRIVATE_KEY not set",
   "economic calendar unavailable: FMP HTTP 404 for https://financialmodelingprep.com/stable/economics-calendar: []",
   "No dealer-positioning reading today, so nothing here accounts for option hedging flows.",
   "Two macro scenarios fit today's data almost equally well. Treat the overlap between them as the honest read rather than the winner.",
   "A scenario score is the share of that story's conditions currently met. It is not a probability and was never fitted to history.",
   "This layer does not size, does not name a ticker and places nothing. It produces a family of expressions and a multiplier on the PM's own risk budget."
  ],
  "oldest_source_days_behind": 1,
  "source": "aqe_crown_macro.json (read_me_first, the_call, key_levels, limits — relayed, never re-generated)"
 },
 "sectors": [
  {
   "etf": "XLF",
   "sector": "Financials",
   "grade": "DEPLOY",
   "rrg_quadrant": "LEADING",
   "rrg_direction": "DEEPENING",
   "macro_headwind_flag": "NEUTRAL",
   "entry_gate": "PASS",
   "entry_gate_reason": "Grade + RRG + macro aligned",
   "source": "srm[etf=XLF]"
  },
  {
   "etf": "XLE",
   "sector": "Energy",
   "grade": "DEPLOY",
   "rrg_quadrant": "LEADING",
   "rrg_direction": "EXITING",
   "macro_headwind_flag": "NEUTRAL",
   "entry_gate": "PASS",
   "entry_gate_reason": "Grade + RRG + macro aligned",
   "source": "srm[etf=XLE]"
  },
  {
   "etf": "XLV",
   "sector": "Healthcare",
   "grade": "HOLD",
   "rrg_quadrant": "LEADING",
   "rrg_direction": "ENTERING",
   "macro_headwind_flag": "CAUTION",
   "entry_gate": "WATCH",
   "entry_gate_reason": "Grade HOLD / RRG LEADING / Macro CAUTION",
   "source": "srm[etf=XLV]"
  },
  {
   "etf": "XLI",
   "sector": "Industrials",
   "grade": "HOLD",
   "rrg_quadrant": "LEADING",
   "rrg_direction": "ENTERING",
   "macro_headwind_flag": "NEUTRAL",
   "entry_gate": "PASS",
   "entry_gate_reason": "Grade + RRG + macro aligned",
   "source": "srm[etf=XLI]"
  },
  {
   "etf": "XLP",
   "sector": "Consumer Staples",
   "grade": "HOLD",
   "rrg_quadrant": "LEADING",
   "rrg_direction": "DEEPENING",
   "macro_headwind_flag": "HEADWIND",
   "entry_gate": "CAUTION",
   "entry_gate_reason": "Macro headwind",
   "source": "srm[etf=XLP]"
  },
  {
   "etf": "XLRE",
   "sector": "Real Estate",
   "grade": "HOLD",
   "rrg_quadrant": "LEADING",
   "rrg_direction": "DEEPENING",
   "macro_headwind_flag": "HEADWIND",
   "entry_gate": "CAUTION",
   "entry_gate_reason": "Macro headwind",
   "source": "srm[etf=XLRE]"
  },
  {
   "etf": "XLK",
   "sector": "Technology",
   "grade": "TURNING",
   "rrg_quadrant": "LAGGING",
   "rrg_direction": "STABLE",
   "macro_headwind_flag": "HEADWIND",
   "entry_gate": "BLOCKED",
   "entry_gate_reason": "HEADWIND macro + LAGGING RRG",
   "source": "srm[etf=XLK]"
  },
  {
   "etf": "XLU",
   "sector": "Utilities",
   "grade": "WATCH",
   "rrg_quadrant": "LEADING",
   "rrg_direction": "DEEPENING",
   "macro_headwind_flag": "HEADWIND",
   "entry_gate": "CAUTION",
   "entry_gate_reason": "Macro headwind",
   "source": "srm[etf=XLU]"
  },
  {
   "etf": "XLB",
   "sector": "Materials",
   "grade": "WATCH",
   "rrg_quadrant": "LEADING",
   "rrg_direction": "ENTERING",
   "macro_headwind_flag": "HEADWIND",
   "entry_gate": "CAUTION",
   "entry_gate_reason": "Macro headwind",
   "source": "srm[etf=XLB]"
  },
  {
   "etf": "XLY",
   "sector": "Consumer Discretionary",
   "grade": "AVOID",
   "rrg_quadrant": "LAGGING",
   "rrg_direction": "DEEPENING",
   "macro_headwind_flag": "HEADWIND",
   "entry_gate": "BLOCKED",
   "entry_gate_reason": "AVOID grade",
   "source": "srm[etf=XLY]"
  },
  {
   "etf": "XLC",
   "sector": "Communication Services",
   "grade": "AVOID",
   "rrg_quadrant": "LAGGING",
   "rrg_direction": "ENTERING",
   "macro_headwind_flag": "HEADWIND",
   "entry_gate": "BLOCKED",
   "entry_gate_reason": "AVOID grade",
   "source": "srm[etf=XLC]"
  }
 ],
 "cross_asset": {
  "dollar": {
   "text": "Dollar (UUP) RISING: close 28.6, roc5 0.74, roc20 0.49, above_sma20 True.",
   "values": {
    "close": 28.6,
    "roc5": 0.74,
    "roc20": 0.49
   },
   "sources": [
    "intermarket.uup",
    "macro_weather.uup_direction"
   ]
  },
  "bonds": {
   "text": "Bonds (TLT) FALLING: close 83.75, roc5 -0.17, roc20 -4.13.",
   "values": {
    "close": 83.75,
    "roc5": -0.17,
    "roc20": -4.13
   },
   "sources": [
    "intermarket.tlt",
    "macro_weather.tlt_direction"
   ]
  },
  "credit": {
   "text": "Credit (HYG) FALLING: close 79.27, roc5 -0.51, HYG-TLT spread -0.34.",
   "values": {
    "close": 79.27,
    "roc5": -0.51,
    "hyg_tlt_spread": -0.34
   },
   "sources": [
    "intermarket.hyg",
    "macro_weather.hyg_direction"
   ]
  },
  "breadth": {